### ISSUE TITLE
Pods don't have connectivity to external networks

### ISSUE THREAD

**Issue by seanknox** [Azure/azure-container-networking#128]
**Is this a request for help?**: yes

---

**Is this an ISSUE or FEATURE REQUEST?** (choose one): issue
 
---

**Which release version?**: v1.0.3

---

**Which componenet (CNI/IPAM/CNM/CNS)**: CNI

---

**Which Orchestrator and version (e.g. Kubernetes, Docker)** Kubernetes v1.10.1 and containerd 1.1.0-rc.2

**What happened**: 
Pod, node, master network: 10.1.0.0/16

- ✅ node to pods: OK
- ✅ master to pods: OK
- ✅ pod to nodes: OK
- ✅ pod to master: OK
- ✅ pod to pod: OK
- ❌ pod to any remote network (non-pod, non-node/master): no connectivity. This can be external hosts on the internet (e.g. 4.2.2.1) or the kubernetes service network which in my cluster is 10.3.0.0/24

I can see the outbound pod packets on the Azure bridge interface on the node:
```shell
ubuntu@node1:~$ sudo tcpdump -n host 10.1.1.63
tcpdump: verbose output suppressed, use -v or -vv for full protocol decode
listening on eth0, link-type EN10MB (Ethernet), capture size 262144 bytes
18:15:02.450024 IP 10.1.1.63.35878 > 10.3.0.1.443: Flags [S], seq 3742509075, win 29200, options [mss 1460,sackOK,TS val 3312626107 ecr 0,nop,wscale 7], length 0
18:21:54.973662 IP 10.1.1.63 > 4.2.2.1: ICMP echo request, id 80, seq 1, length 64
18:21:55.999938 IP 10.1.1.63 > 4.2.2.1: ICMP echo request, id 80, seq 2, length 64
18:21:57.023913 IP 10.1.1.63 > 4.2.2.1: ICMP echo request, id 80, seq 3, length 64
18:21:58.047939 IP 10.1.1.63 > 4.2.2.1: ICMP echo request, id 80, seq 4, length 64
18:22:00.063929 ARP, Request who-has 10.1.0.1 tell 10.1.1.63, length 28
18:22:01.087965 ARP, Request who-has 10.1.0.1 tell 10.1.1.63, length 28
18:22:02.111919 ARP, Request who-has 10.1.0.1 tell 10.1.1.63, length 28
```

**What you expected to happen**:
- remote connectivity works

**How to reproduce it** (as minimally and precisely as possible): try curl'ing the Kubernetes service IP:

1. exec into a pod
2. try pinging or connecting to any host not on the pod network:
```shell
# pod IP is 10.1.1.63
root@nettools2-5669f4cd85-k948n:/# curl -I -k https://10.3.0.1
curl: (7) Failed to connect to 10.3.0.1 port 443: Connection timed out

root@nettools2-5669f4cd85-k948n:/# ping 4.2.2.1
PING 4.2.2.1 (4.2.2.1) 56(84) bytes of data.
^C
--- 4.2.2.1 ping statistics ---
4 packets transmitted, 0 received, 100% packet loss, time 3074ms
```

**Anything else we need to know**:

```shell
# CNI config:
{
   "cniVersion":"0.3.0",
   "name":"azure",
   "plugins":[
      {
         "type":"azure-vnet",
         "mode":"bridge",
         "bridge":"azure0",
         "ipam":{
            "type":"azure-vnet-ipam"
         }
      },
      {
         "type":"portmap",
         "capabilities":{
            "portMappings":true
         },
         "snat":true
      }
   ]
}
```

```shell
# iptables rules
ubuntu@node1:/var/log$ sudo iptables -L
Chain INPUT (policy ACCEPT)
target     prot opt source               destination
KUBE-EXTERNAL-SERVICES  all  --  anywhere             anywhere             ctstate NEW /* kubernetes externally-visible service portals */
KUBE-FIREWALL  all  --  anywhere             anywhere

Chain FORWARD (policy ACCEPT)
target     prot opt source               destination
KUBE-FORWARD  all  --  anywhere             anywhere             /* kubernetes forwarding rules */

Chain OUTPUT (policy ACCEPT)
target     prot opt source               destination
KUBE-SERVICES  all  --  anywhere             anywhere             ctstate NEW /* kubernetes service portals */
KUBE-FIREWALL  all  --  anywhere             anywhere

Chain KUBE-EXTERNAL-SERVICES (1 references)
target     prot opt source               destination

Chain KUBE-FIREWALL (2 references)
target     prot opt source               destination
DROP       all  --  anywhere             anywhere             /* kubernetes firewall for dropping marked packets */ mark match 0x8000/0x8000

Chain KUBE-FORWARD (1 references)
target     prot opt source               destination
ACCEPT     all  --  anywhere             anywhere             /* kubernetes forwarding rules */ mark match 0x4000/0x4000
ACCEPT     all  --  10.1.0.0/16          anywhere             /* kubernetes forwarding conntrack pod source rule */ ctstate RELATED,ESTABLISHED
ACCEPT     all  --  anywhere             10.1.0.0/16          /* kubernetes forwarding conntrack pod destination rule */ ctstate RELATED,ESTABLISHED

Chain KUBE-SERVICES (1 references)
target     prot opt source               destination
REJECT     udp  --  anywhere             10.3.0.10            /* kube-system/kube-dns:dns has no endpoints */ udp dpt:domain reject-with icmp-port-unreachable
REJECT     tcp  --  anywhere             10.3.0.10            /* kube-system/kube-dns:dns-tcp has no endpoints */ tcp dpt:domain reject-with icmp-port-unreachable
REJECT     tcp  --  anywhere             10.3.0.11            /* kube-system/kubernetes-dashboard: has no endpoints */ tcp dpt:https reject-with icmp-port-unreachable
```

```shell
# ebtables NAT rules

ubuntu@node1:/var/log$ sudo /sbin/ebtables -t nat --list
Bridge table: nat

Bridge chain: PREROUTING, entries: 12, policy: ACCEPT
-p ARP --arp-op Request --arp-ip-dst 10.1.0.224 -j arpreply --arpreply-mac 0:d:3a:6:2c:a6
-p ARP -i eth0 --arp-op Reply -j dnat --to-dst ff:ff:ff:ff:ff:ff --dnat-target ACCEPT
-p ARP --arp-op Request --arp-ip-dst 10.1.0.227 -j arpreply --arpreply-mac ee:19:c0:4f:fd:15
-p IPv4 -i eth0 --ip-dst 10.1.0.227 -j dnat --to-dst ee:19:c0:4f:fd:15 --dnat-target ACCEPT
-p ARP --arp-op Request --arp-ip-dst 10.1.0.246 -j arpreply --arpreply-mac 12:49:d2:3c:3d:7b
-p IPv4 -i eth0 --ip-dst 10.1.0.246 -j dnat --to-dst 12:49:d2:3c:3d:7b --dnat-target ACCEPT
-p ARP --arp-op Request --arp-ip-dst 10.1.0.252 -j arpreply --arpreply-mac 52:71:2a:e3:eb:b7
-p IPv4 -i eth0 --ip-dst 10.1.0.252 -j dnat --to-dst 52:71:2a:e3:eb:b7 --dnat-target ACCEPT
-p ARP --arp-op Request --arp-ip-dst 10.1.0.228 -j arpreply --arpreply-mac da:bf:a4:b0:97:27
-p IPv4 -i eth0 --ip-dst 10.1.0.228 -j dnat --to-dst da:bf:a4:b0:97:27 --dnat-target ACCEPT
-p ARP --arp-op Request --arp-ip-dst 10.1.1.63 -j arpreply --arpreply-mac 6e:d:eb:76:f5:9
-p IPv4 -i eth0 --ip-dst 10.1.1.63 -j dnat --to-dst 6e:d:eb:76:f5:9 --dnat-target ACCEPT

Bridge chain: OUTPUT, entries: 0, policy: ACCEPT

Bridge chain: POSTROUTING, entries: 1, policy: ACCEPT
-s Unicast -o eth0 -j snat --to-src 0:d:3a:6:2c:a6 --snat-arp --snat-target ACCEPT
```

**Comment by sharmasushant** [comment]
@tamilmani1989 is looking into this.

**Comment by IvanovOleg** [comment]
I have the same issue on CoreOS and Kubernetes 1.10.3

**Comment by coreywagehoft** [comment]
Any updates on this @sharmasushant ?

**Comment by justpolidor** [comment]
Same issue here.

**Comment by IvanovOleg** [comment]
This issue is related to a missing firewall rule.
Add the next string to the kubelet systemd service:
`ExecStartPre=-/sbin/iptables -t nat -A POSTROUTING -m iprange ! --dst-range 168.63.129.16 -m addrtype ! --dst-type local ! -d $NETWORK_ADDRESS_RANGE -j MASQUERADE`

**Comment by limpair** [comment]
@tamilmani1989 I also encountered this problem using the latest cni

**Comment by tamilmani1989** [comment]
looks like there is no issue with connectivity to external networks, Closing this issue.
@limpair Open a new issue and give us more details about what's failing for you and why do you need an interface?

**Comment by samvdb** [comment]
> This issue is related to a missing firewall rule.
> Add the next string to the kubelet systemd service:
> `ExecStartPre=-/sbin/iptables -t nat -A POSTROUTING -m iprange ! --dst-range 168.63.129.16 -m addrtype ! --dst-type local ! -d $NETWORK_ADDRESS_RANGE -j MASQUERADE`

That iptables rules worked magic, thank you so much!
