### ISSUE TITLE
IPVS doesn't work with Azure CNI

### ISSUE THREAD

**Issue by amodm** [Azure/azure-container-networking#447]
**Is this a request for help?**:
Yes

---

**Is this an ISSUE or FEATURE REQUEST?** (choose one):
Issue

---

**Which release version?**:
Latest (1.0.29)

---

**Which component (CNI/IPAM/CNM/CNS)**:
CNI

---

**Which Operating System (Linux/Windows)**:
Linux

---

**For Linux: Include Distro and kernel version using "uname -a"**
`Linux k8s-agentpool1-cen1-vmss000001 5.0.0-1023-azure #24~18.04.1-Ubuntu SMP Wed Oct 2 20:23:29 UTC 2019 x86_64 x86_64 x86_64 GNU/Linux`

---

**Which Orchestrator and version (e.g. Kubernetes, Docker)**
Kubernetes 1.16.2

---

**What happened**:
When setting up a cluster with IPVS as the kubeproxy mode, on an Azure CNI enabled network, cluster IPs are not reachable via pods.

Environment details:
* Azure VNet: 10.73.0.0/16
* Service network: 172.21.0.0/16
* DNS Service IP: 172.21.255.1
* Deployment via aks-engine

When setting up a new cluster, I found that CoreDNS pods are not able to reach the cluster IP `172.21.0.1`, and throw up the following logs
```
$ kubectl -n kube-system logs coredns-56bc7dfcc6-wgb6r
E1121 01:47:48.755559       1 reflector.go:126] pkg/mod/k8s.io/client-go@v11.0.0+incompatible/tools/cache/reflector.go:94: Failed to list *v1.Namespace: Get https://172.21.0.1:443/api/v1/namespaces?limit=500&resourceVersion=0: dial tcp 172.21.0.1:443: i/o timeout
E1121 01:47:48.755559       1 reflector.go:126] pkg/mod/k8s.io/client-go@v11.0.0+incompatible/tools/cache/reflector.go:94: Failed to list *v1.Namespace: Get https://172.21.0.1:443/api/v1/namespaces?limit=500&resourceVersion=0: dial tcp 172.21.0.1:443: i/o timeout
E1121 01:47:48.755559       1 reflector.go:126] pkg/mod/k8s.io/client-go@v11.0.0+incompatible/tools/cache/reflector.go:94: Failed to list *v1.Namespace: Get https://172.21.0.1:443/api/v1/namespaces?limit=500&resourceVersion=0: dial tcp 172.21.0.1:443: i/o timeout
E1121 01:47:48.755559       1 reflector.go:126] pkg/mod/k8s.io/client-go@v11.0.0+incompatible/tools/cache/reflector.go:94: Failed to list *v1.Namespace: Get https://172.21.0.1:443/api/v1/namespaces?limit=500&resourceVersion=0: dial tcp 172.21.0.1:443: i/o timeout
E1121 01:48:19.754336       1 reflector.go:126] pkg/mod/k8s.io/client-go@v11.0.0+incompatible/tools/cache/reflector.go:94: Failed to list *v1.Service: Get https://172.21.0.1:443/api/v1/services?limit=500&resourceVersion=0: dial tcp 172.21.0.1:443: i/o timeout
```

Please note that the IP `172.21.0.1` is a valid cluster IP in the cluster
```
$ kubectl get svc -o wide
NAME         TYPE        CLUSTER-IP   EXTERNAL-IP   PORT(S)   AGE     SELECTOR
kubernetes   ClusterIP   172.21.0.1   <none>        443/TCP   5d15h   <none>
```
and is reachable via the node on which the CoreDNS pod is running
```
me@k8s-agentpool1-cen1-vmss000001:~$ curl --insecure 'https://172.21.0.1:443/api/v1/services' # Run on the Node
{
  "kind": "Status",
  "apiVersion": "v1",
  "metadata": {
    
  },
  "status": "Failure",
  "message": "Unauthorized",
  "reason": "Unauthorized",
  "code": 401
}
```

As is to be expected, IPVS was correctly set up on the node (172.21.0.1:443 is pointing to API server LB IP)
```
me@k8s-agentpool1-cen1-vmss000001:~$ sudo ipvsadm -Ln
IP Virtual Server version 1.2.1 (size=4096)
Prot LocalAddress:Port Scheduler Flags
  -> RemoteAddress:Port           Forward Weight ActiveConn InActConn
TCP  127.0.0.1:30271 rr
TCP  172.17.0.1:30271 rr
TCP  172.21.0.1:443 rr
  -> 10.73.127.234:443            Masq    1      0          0         
TCP  172.21.23.199:443 rr
TCP  172.21.166.66:443 rr
  -> 10.73.0.121:443              Masq    1      0          0         
TCP  172.21.240.234:44134 rr
  -> 10.73.0.222:44134            Masq    1      0          0         
TCP  172.21.255.1:53 rr
  -> 10.73.0.139:53               Masq    1      0          0         
TCP  172.21.255.1:9153 rr
  -> 10.73.0.139:9153             Masq    1      0          0         
TCP  10.73.0.101:30271 rr
UDP  172.21.255.1:53 rr
  -> 10.73.0.139:53               Masq    1      0          0  
```

To test, a tmp shell pod was created to fire a curl request, and as can be seen, it times out
```
$ kubectl run tmp-shell --image curlimages/curl --overrides='{"apiVersion": "v1","spec": {"nodeSelector": {"kubernetes.io/hostname": "k8s-agentpool1-cen1-vmss000001"}}}' --restart=Never --tty=true --attach=true --stdin=true --rm=true --generator=run-pod/v1 sh
If you don't see a command prompt, try pressing enter.
/ $ curl --insecure -m 10 'https://172.21.0.1:443/api/v1/services' # Run inside POD
curl: (28) Connection timed out after 10001 milliseconds
/ $ ip route show
default via 10.73.0.1 dev eth0 
10.73.0.0/17 dev eth0 scope link  src 10.73.0.108 
/ $ arp -n
? (10.73.0.1) at 12:34:56:78:9a:bc [ether]  on eth0
```

While the above curl request was being made, a tcpdump was being run on the node, showing no response packets whatsoever
```
me@k8s-agentpool1-cen1-vmss000001:~$ sudo tcpdump -nei azure0 host 172.21.0.1
tcpdump: verbose output suppressed, use -v or -vv for full protocol decode
listening on azure0, link-type EN10MB (Ethernet), capture size 262144 bytes
14:40:47.258612 aa:dc:92:37:36:98 > 12:34:56:78:9a:bc, ethertype IPv4 (0x0800), length 74: 10.73.0.108.47806 > 172.21.0.1.443: Flags [S], seq 2710729044, win 64240, options [mss 1460,sackOK,TS val 3312929477 ecr 0,nop,wscale 7], length 0
14:40:47.270447 ea:41:81:ec:9e:fd > 12:34:56:78:9a:bc, ethertype IPv4 (0x0800), length 74: 10.73.0.121.58652 > 172.21.0.1.443: Flags [S], seq 2890231579, win 64240, options [mss 1460,sackOK,TS val 2053885798 ecr 0,nop,wscale 7], length 0
14:40:48.262517 aa:dc:92:37:36:98 > 12:34:56:78:9a:bc, ethertype IPv4 (0x0800), length 74: 10.73.0.108.47806 > 172.21.0.1.443: Flags [S], seq 2710729044, win 64240, options [mss 1460,sackOK,TS val 3312930481 ecr 0,nop,wscale 7], length 0
14:40:50.278484 aa:dc:92:37:36:98 > 12:34:56:78:9a:bc, ethertype IPv4 (0x0800), length 74: 10.73.0.108.47806 > 172.21.0.1.443: Flags [S], seq 2710729044, win 64240, options [mss 1460,sackOK,TS val 3312932497 ecr 0,nop,wscale 7], length 0
```

As can be clearly seen above, because of CNI, the pod is sending packets destined for `172.21.0.1` (an IPVS service), wrapped in the mac address of the default gateway `10.73.0.1`. There's nothing in the current ebtables of the node to prevent this packet from being sent on the VNet, instead of being processed by the host node.
```
me@k8s-agentpool1-cen1-vmss000001:~$ sudo ebtables -t nat -Ln
Bridge table: nat

Bridge chain: PREROUTING, entries: 11, policy: ACCEPT
-p ARP -i eth0 --arp-op Reply -j dnat --to-dst ff:ff:ff:ff:ff:ff --dnat-target ACCEPT
-p ARP --arp-op Request --arp-ip-dst 10.73.0.121 -j arpreply --arpreply-mac ea:41:81:ec:9e:fd
-p IPv4 -i eth0 --ip-dst 10.73.0.121 -j dnat --to-dst ea:41:81:ec:9e:fd --dnat-target ACCEPT
-p ARP --arp-op Request --arp-ip-dst 10.73.0.139 -j arpreply --arpreply-mac 8a:e1:e2:22:fe:91
-p IPv4 -i eth0 --ip-dst 10.73.0.139 -j dnat --to-dst 8a:e1:e2:22:fe:91 --dnat-target ACCEPT
-p ARP --arp-op Request --arp-ip-dst 10.73.0.114 -j arpreply --arpreply-mac da:67:73:ab:32:5d
-p IPv4 -i eth0 --ip-dst 10.73.0.114 -j dnat --to-dst da:67:73:ab:32:5d --dnat-target ACCEPT
-p ARP --arp-op Request --arp-ip-dst 10.73.0.112 -j arpreply --arpreply-mac 42:d4:84:19:ad:b
-p IPv4 -i eth0 --ip-dst 10.73.0.112 -j dnat --to-dst 42:d4:84:19:ad:b --dnat-target ACCEPT
-p ARP --arp-op Request --arp-ip-dst 10.73.0.108 -j arpreply --arpreply-mac 92:b8:e2:17:e8:ad
-p IPv4 -i eth0 --ip-dst 10.73.0.108 -j dnat --to-dst 92:b8:e2:17:e8:ad --dnat-target ACCEPT

Bridge chain: OUTPUT, entries: 0, policy: ACCEPT

Bridge chain: POSTROUTING, entries: 1, policy: ACCEPT
-s Unicast -o eth0 -j snat --to-src 0:d:3a:f0:32:b0 --snat-arp --snat-target ACCEPT
me@k8s-agentpool1-cen1-vmss000001:~$ sudo ebtables -Ln
Bridge table: filter

Bridge chain: INPUT, entries: 0, policy: ACCEPT

Bridge chain: FORWARD, entries: 0, policy: ACCEPT

Bridge chain: OUTPUT, entries: 0, policy: ACCEPT
me@k8s-agentpool1-cen1-vmss000001:~$ sudo ebtables -t broute -Ln
Bridge table: broute

Bridge chain: BROUTING, entries: 0, policy: ACCEPT
```
---

**What you expected to happen**:
Service IPs need to be reachable from the Pods, when running a cluster with IPVS + CNI enabled on Azure.

---

**How to reproduce it** (as minimally and precisely as possible):
1. Set up an IPVS enabled cluster with CNI on Azure. I set it up using aks-engine, but I suspect the issue with show up with any other method as well.
1. Validate on any node that service IPs are configured as IPVS: `ipvsadm -Ln`
1. Validate that these service IPs are reachable from the nodes (sample command mentioned above)
1. Spawn a temp shell pod (sample command mentioned above), and try reaching any of the cluster IPs from the pod - they time out.

**Comment by amodm** [comment]
Two possible ways, to my mind, of addressing this (both have been tested by me to work):
1. Have a `broute` configured on the node to modify the destination mac address for packets going out via the container interface, so that the host node has an opportunity to address the connection (via IPVS). This can be done by the command: `ebtables -t broute -A BROUTING -i <container-iface> -p IPv4 -j redirect --redirect-target ACCEPT`
1. Have the pods use the host node's IP as the default gateway. 

I feel the latter approach is leaky, so the former should be the preferred approach, unless there's a better way.

**Comment by amodm** [comment]
Possibly linked with #344

**Comment by tamilmani1989** [comment]
@amodm I'm working on this. I tried to create aks cluster with kubeproxy in ipvs mode..following your steps . I'm getting some issues with setup. can you help me with that. I tried to run following cmd and it returned error. Does the error mean ipvs not enabled in this cluster?

rnmadmin@k8s-cniagtvm1-32662751-0:~$ sudo ipvsadm -Ln
sudo: ipvsadm: command not found

cluster config change:
"kubernetesConfig": {
"networkPlugin": "azure",
"networkPolicy": "azure",
"azureCNIVersion": "",
"azureCNIURLLinux": "",
"kubeProxyMode" : "ipvs",

share me your cluster config that would be helpful

**Comment by amodm** [comment]
Assuming you're on a Debian/Ubuntu derivative, you can do `sudo apt install ipvsadm`

**Comment by amodm** [comment]
`ipvsadm` is not installed by default on Azure's aks distribution, so you'll need to do `sudo apt install ipvsadm`

**Comment by tamilmani1989** [comment]
Thanks @amodm . I thought ipvsadm installed by default when kubeproxy is set to ipvs

**Comment by tamilmani1989** [comment]
I compared it with azure cni - kubeproxy iptable mode:

In ibtable mode,
For service ips(10.0.0.1 or 10.0.0.10) there are equaivalent DNAT rules in iptable nat table and packets are getting DNATed before leaving VM

In IPVS mode,
For service ips(10.0.0.1 or 10.0.0.10) there are no equaivalent DNAT rules in iptable nat table but found in ipvs. I believe this as equivalent DNAT rule in ipvs:
TCP  10.0.0.1:443 rr
  -> 10.255.255.5:443             Masq    1      3          0

But when i took tcpdump the packets are not getting DNAT. 

Then applied the above ebtable rule and i see its working. 
**So does the problem here is destination mac should be one of host interface mac to work with ipvs?**

Also we have to make sure this ebtable rule doesn't introduce any network performace issue. I took tcpdump traffic(pod->pod same VM) and i saw 2 packets for each request with broute rule. First its sending to hostveth mac and then its converting to pod mac but this is not the case previously

with brouting rule:

```
01:28:20.847995 d6:c0:c4:dd:1d:14 > 22:63:af:48:c6:6b, ethertype IPv4 (0x0800), length 98: 10.240.0.14 > 10.240.0.31: ICMP echo request, id 73, seq 9, length 64 
01:28:20.848019 00:0d:3a:7a:86:36 > de:cf:3c:e2:49:9f, ethertype IPv4 (0x0800), length 98: 10.240.0.14 > 10.240.0.31: ICMP echo request, id 73, seq 9, length 64
01:28:20.848055 de:cf:3c:e2:49:9f > 86:51:d5:e4:ee:d1, ethertype IPv4 (0x0800), length 98: 10.240.0.31 > 10.240.0.14: ICMP echo reply, id 73, seq 9, length 64
01:28:20.848060 00:0d:3a:7a:86:36 > d6:c0:c4:dd:1d:14, ethertype IPv4 (0x0800), length 98: 10.240.0.31 > 10.240.0.14: ICMP echo reply, id 73, seq 9, length 64
```

Without brouting rule:

```
> 01:31:24.387412 d6:c0:c4:dd:1d:14 > de:cf:3c:e2:49:9f, ethertype IPv4 (0x0800), length 98: 10.240.0.14 > 10.240.0.31: ICMP echo request, id 74, seq 1, length 64
> 01:31:24.387430 de:cf:3c:e2:49:9f > d6:c0:c4:dd:1d:14, ethertype IPv4 (0x0800), length 98: 10.240.0.31 > 10.240.0.14: ICMP echo reply, id 74, seq 1, length 64
```

**Comment by amodm** [comment]
@tamilmani1989 all the packets are going via the host node anyways, so in that sense whatever processing hit you're talking about is non-existent. Also, please note that in IPVS, the service is implemented as VS on the node, so there's really no way around making the packet be processed by the host. We're currently running this on a fairly large sized production setup with zero issues.

**Comment by amodm** [comment]
I suppose one optimisation that could done is to make the rule from the current
> -A BROUTING -p IPv4 -i azvdb9beb3a18e -j redirect

to

> -A BROUTING -p IPv4 -i azvdb9beb3a18e --ip-dst 172.21.0.0/16 -j redirect

(assuming that your cluster ip is `172.21.0.0/16`)

This will ensure that this processing is done only for the cluster IPs, while any packets for any non-cluster IPs skip this rule. I haven't tested this though. But then, most calls in a typical Kubernetes setup will be between services (cluster IPs) anyways.

**Comment by tamilmani1989** [comment]
@amodm CNI doesn't have knowledge of service ip ranges. These ranges are customer defined and  only AKS knows about it.


>  you're talking about is non-existent

Let me gather network performance metrics of both cases and confirm there is no issue.

**Comment by tamilmani1989** [comment]
@amodm  i see a performance hit with this rule if two pods are on same node. If pods are on different node, there is no difference. I tested using iperf3 tool multiple times and the results are consistent.

**Pods on same node:**
With Brouting rule: 20Gbps
Without Brouting rule: 22.5Gbps

Let me check internally with my team and update you.

**Comment by tamilmani1989** [comment]
@amodm I discussed this with my team. We can have this rule only if kube proxy run in ipvs mode and only for service ip ranges.. So enabling the ipvs config flag should come from AKS. In aks-engine code, have to check if kubeproxy runs in ipvs mode and set this flag and service iprange in cni conflist. 

@aanandr @chandanAggarwal

**Comment by amodm** [comment]
@tamilmani1989 makes sense. What does this mean in terms of getting IPVS to work on Azure, and this patch? Currently we're missing out on further updates on Azure CNI because we're running on an older branch that has this patch. Those aren't time critical, but would be ideal for our patch to not diverge too much from the mainline. Of it there's a better way to make IPVS work, that's cool as well.

**Comment by tamilmani1989** [comment]
Yes defaults in #448 has to change. By default it should be disabled. You have to create PR with aks-engine to add 2 fields. One for enabling ipvs and other should be service cidr. These two fields should be updated from  aks-engine

**Comment by tamilmani1989** [comment]
@amodm I'm making changes in aks-engine to pass service cidr in conflist if kube-proxy runs in ipvs mode. The CNI will read conflist and add ebtable brouting rule for service IPs

**Comment by amodm** [comment]
Great! Let me know when this is available, and I'll make use of it to update the routes only for the service cidr

**Comment by tamilmani1989** [comment]
@amodm sorry for updating late. aks-engine changes are merged to master and cni changes as well. you can pull latest aks-e master and can use that. The supported cni version is v1.1.0.

Redirecting only service cidr traffic wont work for external load balancer ip. so redirecting all packets is the only solution

**Comment by amodm** [comment]
@tamilmani can you point me to the commit? Is it aks-engine which will be making the ebtables entry?

**Comment by tamilmani1989** [comment]
The latest AKS-E release should have it. CNI adds ebtable entries based on config set by AKS-E

**Comment by ArchangelSDY** [comment]
@tamilmani1989 I see `setBrouteRedirect` is only called when IPv6 is enabled. Does that mean IPVS only works with dual-stack? IPv4 Only + IPVS seems not working on my side.

https://github.com/Azure/azure-container-networking/blob/f63d8ca79af022f9bc77939ce96e1f4d358ffc4b/network/bridge_networkclient_linux.go#L92-L110

https://github.com/Azure/azure-container-networking/blob/f63d8ca79af022f9bc77939ce96e1f4d358ffc4b/network/bridge_networkclient_linux.go#L151-L163
