### ISSUE TITLE
Service Network not working with Azure CNI

### ISSUE THREAD

**Issue by cpressland** [Azure/azure-container-networking#344]
**Is this a request for help?**:

Yes

---
**Is this an ISSUE or FEATURE REQUEST?** (choose one):

Issue

---

**Which release version?**:

v1.0.20

---

**Which component (CNI/IPAM/CNM/CNS)**:

CNI

---

**Which Operating System (Linux/Windows)**:

Linux

---

**For Linux: Include Distro and kernel version using "uname -a"**

```shell
laadmin@master-1:~$ uname -a
Linux master-1 4.18.0-1014-azure #14~18.04.1-Ubuntu SMP Mon Mar 18 16:15:53 UTC 2019 x86_64 x86_64 x86_64 GNU/Linux
```

---

**Which Orchestrator and version (e.g. Kubernetes, Docker)**

Kubernetes 1.14.1

---

**What happened**:

In this below the following IP Ranges are in play:
* Azure VNet Address Space: 10.0.0.0/16
* Azure VNet Subnet: 10.0.0.0/16
* Kubernetes Service Range: 172.16.0.0/20

And the following hosts are running:
* master-1: 10.0.0.4
* worker-1: 10.0.0.5

When building a PoC Kubernetes Cluster using the Azure CNI we're unable to get Service Networking or External Networking to behave as expected. This leads to issues such as CoreDNS being unable to connect to the Kubernetes API.

```shell
laadmin@master-1:~$ kubectl logs -n kube-system coredns-6b44cf876f-97l4p
E0425 09:14:45.151912       1 reflector.go:205] github.com/coredns/coredns/plugin/kubernetes/controller.go:355: Failed to list *v1.Namespace: Get https://172.16.0.1:443/api/v1/namespaces?limit=500&resourceVersion=0: dial tcp 172.16.0.1:443: i/o timeout
E0425 09:14:45.152182       1 reflector.go:205] github.com/coredns/coredns/plugin/kubernetes/controller.go:348: Failed to list *v1.Service: Get https://172.16.0.1:443/api/v1/services?limit=500&resourceVersion=0: dial tcp 172.16.0.1:443: i/o timeout
E0425 09:14:45.152477       1 reflector.go:205] github.com/coredns/coredns/plugin/kubernetes/controller.go:350: Failed to list *v1.Endpoints: Get https://172.16.0.1:443/api/v1/endpoints?limit=500&resourceVersion=0: dial tcp 172.16.0.1:443: i/o timeout
```

If we spin up a busybox pod we can see it gets a Azure VNet IP from the Azure-CNI as expected:
```shell
laadmin@master-1:~$ kubectl get pods -o wide
NAME      READY   STATUS    RESTARTS   AGE   IP          NODE
busybox   1/1     Running   0          9s    10.0.0.46   worker-1
```

And we can also see that the CoreDNS pods also have VNet issued IPs:

```shell
laadmin@master-1:~$ kubectl get pods -o wide -n kube-system
NAME                       READY   STATUS    RESTARTS   AGE   IP          NODE
coredns-6b44cf876f-5dhz4   1/1     Running   0          69s   10.0.0.38   worker-1
coredns-6b44cf876f-xs9b2   1/1     Running   0          69s   10.0.0.14   master-1
```

And we can see that in the default namespace kubernetes has a service with a valid endpoint:

```shell
laadmin@master-1:~$ kubectl describe svc kubernetes
Name:              kubernetes
Namespace:         default
Labels:            component=apiserver
                   provider=kubernetes
Annotations:       <none>
Selector:          <none>
Type:              ClusterIP
IP:                172.16.0.1
Port:              https  443/TCP
TargetPort:        6443/TCP
Endpoints:         10.0.0.4:6443
Session Affinity:  None
Events:            <none>
```

Inside the busybox pod we can connect back to the kubernetes API directly using it's real IP address:
```shell
laadmin@master-1:~$ kubectl exec busybox -- wget https://10.0.0.4:6443/
Connecting to 10.0.0.4:6443 (10.0.0.4:6443)
wget: server returned error: HTTP/1.1 401 Unauthorized
```

And we see the following in tcpdump on the Kubernetes API Server:
```shell
laadmin@master-1:~$ sudo tcpdump host 10.0.0.46
tcpdump: verbose output suppressed, use -v or -vv for full protocol decode
listening on eth0, link-type EN10MB (Ethernet), capture size 262144 bytes
09:44:42.009275 IP 10.0.0.46.38842 > 10.0.0.4.6443: Flags [S], seq 4005347668, win 29200, options [mss 1418,sackOK,TS val 1577812136 ecr 0,nop,wscale 7], length 0
09:44:42.009321 IP 10.0.0.4.6443 > 10.0.0.46.38842: Flags [S.], seq 1204515553, ack 4005347669, win 28960, options [mss 1460,sackOK,TS val 2920480894 ecr 1577812136,nop,wscale 7], length 0
09:44:42.010453 IP 10.0.0.46.38842 > 10.0.0.4.6443: Flags [.], ack 1, win 229, options [nop,nop,TS val 1577812138 ecr 2920480894], length 0
09:44:42.010517 IP 10.0.0.46.38842 > 10.0.0.4.6443: Flags [P.], seq 1:74, ack 1, win 229, options [nop,nop,TS val 1577812138 ecr 2920480894], length 73
09:44:42.010546 IP 10.0.0.4.6443 > 10.0.0.46.38842: Flags [.], ack 74, win 227, options [nop,nop,TS val 2920480895 ecr 1577812138], length 0
09:44:42.011104 IP 10.0.0.4.6443 > 10.0.0.46.38842: Flags [P.], seq 1:1292, ack 74, win 227, options [nop,nop,TS val 2920480896 ecr 1577812138], length 1291
09:44:42.011900 IP 10.0.0.46.38842 > 10.0.0.4.6443: Flags [.], ack 1292, win 251, options [nop,nop,TS val 1577812140 ecr 2920480896], length 0
09:44:42.011925 IP 10.0.0.46.38842 > 10.0.0.4.6443: Flags [P.], seq 74:86, ack 1292, win 251, options [nop,nop,TS val 1577812140 ecr 2920480896], length 12
09:44:42.054068 IP 10.0.0.4.6443 > 10.0.0.46.38842: Flags [.], ack 86, win 227, options [nop,nop,TS val 2920480939 ecr 1577812140], length 0
09:44:42.054714 IP 10.0.0.46.38842 > 10.0.0.4.6443: Flags [P.], seq 86:428, ack 1292, win 251, options [nop,nop,TS val 1577812183 ecr 2920480939], length 342
09:44:42.054734 IP 10.0.0.4.6443 > 10.0.0.46.38842: Flags [.], ack 428, win 235, options [nop,nop,TS val 2920480939 ecr 1577812183], length 0
09:44:42.057370 IP 10.0.0.4.6443 > 10.0.0.46.38842: Flags [P.], seq 1292:1367, ack 428, win 235, options [nop,nop,TS val 2920480942 ecr 1577812183], length 75
09:44:42.057931 IP 10.0.0.46.38842 > 10.0.0.4.6443: Flags [P.], seq 428:561, ack 1367, win 251, options [nop,nop,TS val 1577812186 ecr 2920480942], length 133
09:44:42.058204 IP 10.0.0.4.6443 > 10.0.0.46.38842: Flags [P.], seq 1367:1724, ack 561, win 243, options [nop,nop,TS val 2920480943 ecr 1577812186], length 357
09:44:42.058268 IP 10.0.0.4.6443 > 10.0.0.46.38842: Flags [FP.], seq 1724:1777, ack 561, win 243, options [nop,nop,TS val 2920480943 ecr 1577812186], length 53
09:44:42.058854 IP 10.0.0.46.38842 > 10.0.0.4.6443: Flags [.], ack 1778, win 271, options [nop,nop,TS val 1577812187 ecr 2920480943], length 0
09:44:42.058884 IP 10.0.0.46.38842 > 10.0.0.4.6443: Flags [F.], seq 561, ack 1778, win 271, options [nop,nop,TS val 1577812187 ecr 2920480943], length 0
09:44:42.058913 IP 10.0.0.4.6443 > 10.0.0.46.38842: Flags [.], ack 562, win 243, options [nop,nop,TS val 2920480943 ecr 1577812187], length 0
```

However, if we try the same connecting to the Kubernetes Service IP:Port (172.16.0.1:443) we don't see anything in TCP on the Kubernetes API Server and we get a timeout in the busybox pod:
```shell
laadmin@master-1:~$ kubectl exec busybox -- wget https://172.16.0.1:443/
Connecting to 172.16.0.1:443 (172.16.0.1:443)
wget: can't connect to remote host (172.16.0.1): Connection timed out
```

But on the Container Host (worker-1, 10.0.0.5) we do see the following:
```shell
laadmin@worker-1:~$ sudo tcpdump host 10.0.0.46
tcpdump: verbose output suppressed, use -v or -vv for full protocol decode
listening on eth0, link-type EN10MB (Ethernet), capture size 262144 bytes
09:49:52.842105 IP 10.0.0.46.51990 > 172.16.0.1.https: Flags [S], seq 1610158240, win 29200, options [mss 1460,sackOK,TS val 3256545035 ecr 0,nop,wscale 7], length 0
09:49:53.844880 IP 10.0.0.46.51990 > 172.16.0.1.https: Flags [S], seq 1610158240, win 29200, options [mss 1460,sackOK,TS val 3256546038 ecr 0,nop,wscale 7], length 0
09:49:54.868956 IP 10.0.0.46.51678 > 172.16.0.1.https: Flags [S], seq 3027154396, win 29200, options [mss 1460,sackOK,TS val 3256547062 ecr 0,nop,wscale 7], length 0
09:49:55.860944 IP 10.0.0.46.51990 > 172.16.0.1.https: Flags [S], seq 1610158240, win 29200, options [mss 1460,sackOK,TS val 3256548054 ecr 0,nop,wscale 7], length 0
09:49:57.940864 ARP, Request who-has 10.0.0.1 tell 10.0.0.46, length 28
09:49:58.964929 ARP, Request who-has 10.0.0.1 tell 10.0.0.46, length 28
09:49:59.988911 IP 10.0.0.46.51990 > 172.16.0.1.https: Flags [S], seq 1610158240, win 29200, options [mss 1460,sackOK,TS val 3256552182 ecr 0,nop,wscale 7], length 0
09:49:59.988926 ARP, Request who-has 10.0.0.1 tell 10.0.0.46, length 28
09:50:08.180871 IP 10.0.0.46.51990 > 172.16.0.1.https: Flags [S], seq 1610158240, win 29200, options [mss 1460,sackOK,TS val 3256560374 ecr 0,nop,wscale 7], length 0
09:50:13.300929 ARP, Request who-has 10.0.0.1 tell 10.0.0.46, length 28
09:50:14.324907 ARP, Request who-has 10.0.0.1 tell 10.0.0.46, length 28
09:50:15.348950 ARP, Request who-has 10.0.0.1 tell 10.0.0.46, length 28
09:50:24.308935 IP 10.0.0.46.51990 > 172.16.0.1.https: Flags [S], seq 1610158240, win 29200, options [mss 1460,sackOK,TS val 3256576502 ecr 0,nop,wscale 7], length 0
09:50:29.428938 ARP, Request who-has 10.0.0.1 tell 10.0.0.46, length 28
09:50:30.452865 ARP, Request who-has 10.0.0.1 tell 10.0.0.46, length 28
09:50:31.476861 ARP, Request who-has 10.0.0.1 tell 10.0.0.46, length 28
09:50:58.356911 IP 10.0.0.46.51990 > 172.16.0.1.https: Flags [S], seq 1610158240, win 29200, options [mss 1460,sackOK,TS val 3256610550 ecr 0,nop,wscale 7], length 0
09:51:03.476941 ARP, Request who-has 10.0.0.1 tell 10.0.0.46, length 28
09:51:04.500919 ARP, Request who-has 10.0.0.1 tell 10.0.0.46, length 28
09:51:05.524888 ARP, Request who-has 10.0.0.1 tell 10.0.0.46, length 28
```

Finally, it's also worth noting that connections to the outside world also end up behaving the same way, example here with me trying to connect to a random cloudflare IP address:

```shell
laadmin@master-1:~$ kubectl exec busybox -- wget http://104.20.43.43/
Connecting to 104.20.43.43 (104.20.43.43:80)
wget: can't connect to remote host (104.20.43.43): Connection timed out
```

And once again, similar looking tcpdumps:
```
laadmin@worker-1:~$ sudo tcpdump host 10.0.0.46
tcpdump: verbose output suppressed, use -v or -vv for full protocol decode
listening on eth0, link-type EN10MB (Ethernet), capture size 262144 bytes
09:55:43.264067 IP 10.0.0.46.45012 > 104.20.43.43.http: Flags [S], seq 962823545, win 29200, options [mss 1460,sackOK,TS val 2510597748 ecr 0,nop,wscale 7], length 0
09:55:44.276914 IP 10.0.0.46.45012 > 104.20.43.43.http: Flags [S], seq 962823545, win 29200, options [mss 1460,sackOK,TS val 2510598761 ecr 0,nop,wscale 7], length 0
09:55:46.292937 IP 10.0.0.46.45012 > 104.20.43.43.http: Flags [S], seq 962823545, win 29200, options [mss 1460,sackOK,TS val 2510600777 ecr 0,nop,wscale 7], length 0
09:55:47.124867 IP 10.0.0.46.44692 > 104.20.43.43.http: Flags [S], seq 2132986235, win 29200, options [mss 1460,sackOK,TS val 2510601609 ecr 0,nop,wscale 7], length 0
09:55:48.404853 ARP, Request who-has 10.0.0.1 tell 10.0.0.46, length 28
09:55:49.428904 ARP, Request who-has 10.0.0.1 tell 10.0.0.46, length 28
09:55:50.452915 IP 10.0.0.46.45012 > 104.20.43.43.http: Flags [S], seq 962823545, win 29200, options [mss 1460,sackOK,TS val 2510604937 ecr 0,nop,wscale 7], length 0
09:55:50.452936 ARP, Request who-has 10.0.0.1 tell 10.0.0.46, length 28
09:55:58.644918 IP 10.0.0.46.45012 > 104.20.43.43.http: Flags [S], seq 962823545, win 29200, options [mss 1460,sackOK,TS val 2510613129 ecr 0,nop,wscale 7], length 0
09:56:03.764936 ARP, Request who-has 10.0.0.1 tell 10.0.0.46, length 28
09:56:04.788931 ARP, Request who-has 10.0.0.1 tell 10.0.0.46, length 28
09:56:05.812919 ARP, Request who-has 10.0.0.1 tell 10.0.0.46, length 28
09:56:14.772916 ARP, Request who-has 10.0.0.1 tell 10.0.0.46, length 28
09:56:14.773344 IP 10.0.0.46.45012 > 104.20.43.43.http: Flags [S], seq 962823545, win 29200, options [mss 1460,sackOK,TS val 2510629257 ecr 0,nop,wscale 7], length 0
09:56:19.892900 ARP, Request who-has 10.0.0.1 tell 10.0.0.46, length 28
09:56:20.916894 ARP, Request who-has 10.0.0.1 tell 10.0.0.46, length 28
09:56:21.940900 ARP, Request who-has 10.0.0.1 tell 10.0.0.46, length 28
09:56:48.564962 IP 10.0.0.46.45012 > 104.20.43.43.http: Flags [S], seq 962823545, win 29200, options [mss 1460,sackOK,TS val 2510663049 ecr 0,nop,wscale 7], length 0
09:56:53.684930 ARP, Request who-has 10.0.0.1 tell 10.0.0.46, length 28
09:56:54.708908 ARP, Request who-has 10.0.0.1 tell 10.0.0.46, length 28
09:56:55.732900 ARP, Request who-has 10.0.0.1 tell 10.0.0.46, length 28
```

Dump of `iptables -L` from `master-1`
```
laadmin@master-1:~$ sudo iptables -L
Chain INPUT (policy ACCEPT)
target     prot opt source               destination
KUBE-SERVICES  all  --  anywhere             anywhere             ctstate NEW /* kubernetes service portals */
KUBE-EXTERNAL-SERVICES  all  --  anywhere             anywhere             ctstate NEW /* kubernetes externally-visible service portals */
KUBE-FIREWALL  all  --  anywhere             anywhere

Chain FORWARD (policy ACCEPT)
target     prot opt source               destination
KUBE-FORWARD  all  --  anywhere             anywhere             /* kubernetes forwarding rules */
KUBE-SERVICES  all  --  anywhere             anywhere             ctstate NEW /* kubernetes service portals */

Chain OUTPUT (policy ACCEPT)
target     prot opt source               destination
KUBE-SERVICES  all  --  anywhere             anywhere             ctstate NEW /* kubernetes service portals */
KUBE-FIREWALL  all  --  anywhere             anywhere

Chain KUBE-EXTERNAL-SERVICES (1 references)
target     prot opt source               destination

Chain KUBE-FIREWALL (2 references)
target     prot opt source               destination
DROP       all  --  anywhere             anywhere             /* kubernetes firewall for dropping marked packets */ mark match 0x8000/0x8000

Chain KUBE-FORWARD (1 references)
target     prot opt source               destination
ACCEPT     all  --  anywhere             anywhere             /* kubernetes forwarding rules */ mark match 0x4000/0x4000
ACCEPT     all  --  10.0.0.0/16          anywhere             /* kubernetes forwarding conntrack pod source rule */ ctstate RELATED,ESTABLISHED
ACCEPT     all  --  anywhere             10.0.0.0/16          /* kubernetes forwarding conntrack pod destination rule */ ctstate RELATED,ESTABLISHED

Chain KUBE-SERVICES (3 references)
target     prot opt source               destination
REJECT     udp  --  anywhere             172.16.0.10          /* kube-system/coredns:dns has no endpoints */ udp dpt:domain reject-with icmp-port-unreachable
REJECT     tcp  --  anywhere             172.16.0.10          /* kube-system/coredns:dns-tcp has no endpoints */ tcp dpt:domain reject-with icmp-port-unreachable
```

Dump of `iptables -t nat -L` from `master-1`:

```
laadmin@master-1:~$ sudo iptables -t nat -L
Chain PREROUTING (policy ACCEPT)
target     prot opt source               destination
KUBE-SERVICES  all  --  anywhere             anywhere             /* kubernetes service portals */

Chain INPUT (policy ACCEPT)
target     prot opt source               destination

Chain OUTPUT (policy ACCEPT)
target     prot opt source               destination
KUBE-SERVICES  all  --  anywhere             anywhere             /* kubernetes service portals */

Chain POSTROUTING (policy ACCEPT)
target     prot opt source               destination
KUBE-POSTROUTING  all  --  anywhere             anywhere             /* kubernetes postrouting rules */

Chain KUBE-MARK-DROP (0 references)
target     prot opt source               destination
MARK       all  --  anywhere             anywhere             MARK or 0x8000

Chain KUBE-MARK-MASQ (2 references)
target     prot opt source               destination
MARK       all  --  anywhere             anywhere             MARK or 0x4000

Chain KUBE-NODEPORTS (1 references)
target     prot opt source               destination

Chain KUBE-POSTROUTING (1 references)
target     prot opt source               destination
MASQUERADE  all  --  anywhere             anywhere             /* kubernetes service traffic requiring SNAT */ mark match 0x4000/0x4000

Chain KUBE-SEP-SCDYEFQS53DIYLB3 (1 references)
target     prot opt source               destination
KUBE-MARK-MASQ  all  --  10.0.0.4             anywhere
DNAT       tcp  --  anywhere             anywhere             tcp to:10.0.0.4:6443

Chain KUBE-SERVICES (2 references)
target     prot opt source               destination
KUBE-MARK-MASQ  tcp  -- !10.0.0.0/16          172.16.0.1           /* default/kubernetes:https cluster IP */ tcp dpt:https
KUBE-SVC-NPX46M4PTMTKRN6Y  tcp  --  anywhere             172.16.0.1           /* default/kubernetes:https cluster IP */ tcp dpt:https
KUBE-NODEPORTS  all  --  anywhere             anywhere             /* kubernetes service nodeports; NOTE: this must be the last rule in this chain */ ADDRTYPE match dst-type LOCAL

Chain KUBE-SVC-NPX46M4PTMTKRN6Y (1 references)
target     prot opt source               destination
KUBE-SEP-SCDYEFQS53DIYLB3  all  --  anywhere             anywhere
```

Dump of `iptables -L` from `worker-1`

```
laadmin@worker-1:~$ sudo iptables -L
Chain INPUT (policy ACCEPT)
target     prot opt source               destination
KUBE-SERVICES  all  --  anywhere             anywhere             ctstate NEW /* kubernetes service portals */
KUBE-EXTERNAL-SERVICES  all  --  anywhere             anywhere             ctstate NEW /* kubernetes externally-visible service portals */
KUBE-FIREWALL  all  --  anywhere             anywhere

Chain FORWARD (policy ACCEPT)
target     prot opt source               destination
KUBE-FORWARD  all  --  anywhere             anywhere             /* kubernetes forwarding rules */
KUBE-SERVICES  all  --  anywhere             anywhere             ctstate NEW /* kubernetes service portals */

Chain OUTPUT (policy ACCEPT)
target     prot opt source               destination
KUBE-SERVICES  all  --  anywhere             anywhere             ctstate NEW /* kubernetes service portals */
KUBE-FIREWALL  all  --  anywhere             anywhere

Chain KUBE-EXTERNAL-SERVICES (1 references)
target     prot opt source               destination

Chain KUBE-FIREWALL (2 references)
target     prot opt source               destination
DROP       all  --  anywhere             anywhere             /* kubernetes firewall for dropping marked packets */ mark match 0x8000/0x8000

Chain KUBE-FORWARD (1 references)
target     prot opt source               destination
ACCEPT     all  --  anywhere             anywhere             /* kubernetes forwarding rules */ mark match 0x4000/0x4000
ACCEPT     all  --  10.0.0.0/16          anywhere             /* kubernetes forwarding conntrack pod source rule */ ctstate RELATED,ESTABLISHED
ACCEPT     all  --  anywhere             10.0.0.0/16          /* kubernetes forwarding conntrack pod destination rule */ ctstate RELATED,ESTABLISHED

Chain KUBE-SERVICES (3 references)
target     prot opt source               destination
```

Dump of `iptables -t nat -L` from `worker-1`

```shell
laadmin@worker-1:~$ sudo iptables -t nat -L
Chain PREROUTING (policy ACCEPT)
target     prot opt source               destination
KUBE-SERVICES  all  --  anywhere             anywhere             /* kubernetes service portals */

Chain INPUT (policy ACCEPT)
target     prot opt source               destination

Chain OUTPUT (policy ACCEPT)
target     prot opt source               destination
KUBE-SERVICES  all  --  anywhere             anywhere             /* kubernetes service portals */

Chain POSTROUTING (policy ACCEPT)
target     prot opt source               destination
KUBE-POSTROUTING  all  --  anywhere             anywhere             /* kubernetes postrouting rules */

Chain KUBE-MARK-DROP (0 references)
target     prot opt source               destination
MARK       all  --  anywhere             anywhere             MARK or 0x8000

Chain KUBE-MARK-MASQ (8 references)
target     prot opt source               destination
MARK       all  --  anywhere             anywhere             MARK or 0x4000

Chain KUBE-NODEPORTS (1 references)
target     prot opt source               destination

Chain KUBE-POSTROUTING (1 references)
target     prot opt source               destination
MASQUERADE  all  --  anywhere             anywhere             /* kubernetes service traffic requiring SNAT */ mark match 0x4000/0x4000

Chain KUBE-SEP-5NKNC6M5UH7VEERO (1 references)
target     prot opt source               destination
KUBE-MARK-MASQ  all  --  10.0.0.49            anywhere
DNAT       udp  --  anywhere             anywhere             udp to:10.0.0.49:53

Chain KUBE-SEP-RTMBYJA6QVQRTSE6 (1 references)
target     prot opt source               destination
KUBE-MARK-MASQ  all  --  10.0.0.49            anywhere
DNAT       tcp  --  anywhere             anywhere             tcp to:10.0.0.49:53

Chain KUBE-SEP-SCDYEFQS53DIYLB3 (1 references)
target     prot opt source               destination
KUBE-MARK-MASQ  all  --  10.0.0.4             anywhere
DNAT       tcp  --  anywhere             anywhere             tcp to:10.0.0.4:6443

Chain KUBE-SEP-VOJPPBBE5YONN4JH (1 references)
target     prot opt source               destination
KUBE-MARK-MASQ  all  --  10.0.0.30            anywhere
DNAT       tcp  --  anywhere             anywhere             tcp to:10.0.0.30:53

Chain KUBE-SEP-WLO6D7YSWNLWXGK6 (1 references)
target     prot opt source               destination
KUBE-MARK-MASQ  all  --  10.0.0.30            anywhere
DNAT       udp  --  anywhere             anywhere             udp to:10.0.0.30:53

Chain KUBE-SERVICES (2 references)
target     prot opt source               destination
KUBE-MARK-MASQ  tcp  -- !10.0.0.0/16          172.16.0.1           /* default/kubernetes:https cluster IP */ tcp dpt:https
KUBE-SVC-NPX46M4PTMTKRN6Y  tcp  --  anywhere             172.16.0.1           /* default/kubernetes:https cluster IP */ tcp dpt:https
KUBE-MARK-MASQ  udp  -- !10.0.0.0/16          172.16.0.10          /* kube-system/coredns:dns cluster IP */ udp dpt:domain
KUBE-SVC-ZRLRAB2E5DTUX37C  udp  --  anywhere             172.16.0.10          /* kube-system/coredns:dns cluster IP */ udp dpt:domain
KUBE-MARK-MASQ  tcp  -- !10.0.0.0/16          172.16.0.10          /* kube-system/coredns:dns-tcp cluster IP */ tcp dpt:domain
KUBE-SVC-FAITROITGXHS3QVF  tcp  --  anywhere             172.16.0.10          /* kube-system/coredns:dns-tcp cluster IP */ tcp dpt:domain
KUBE-NODEPORTS  all  --  anywhere             anywhere             /* kubernetes service nodeports; NOTE: this must be the last rule in this chain */ ADDRTYPE match dst-type LOCAL

Chain KUBE-SVC-FAITROITGXHS3QVF (1 references)
target     prot opt source               destination
KUBE-SEP-VOJPPBBE5YONN4JH  all  --  anywhere             anywhere             statistic mode random probability 0.50000000000
KUBE-SEP-RTMBYJA6QVQRTSE6  all  --  anywhere             anywhere

Chain KUBE-SVC-NPX46M4PTMTKRN6Y (1 references)
target     prot opt source               destination
KUBE-SEP-SCDYEFQS53DIYLB3  all  --  anywhere             anywhere

Chain KUBE-SVC-ZRLRAB2E5DTUX37C (1 references)
target     prot opt source               destination
KUBE-SEP-WLO6D7YSWNLWXGK6  all  --  anywhere             anywhere             statistic mode random probability 0.50000000000
KUBE-SEP-5NKNC6M5UH7VEERO  all  --  anywhere             anywhere
```

---

**What you expected to happen**:

Service Networking to work from Pod IPs

---

**How to reproduce it**:

Create the following resources in Azure Resource Manager:
* 1 VNet with IP Range of your choice
* 1 Public IP (Standard SKU)
* 1 Public Load Balancer (Standard SKU)
  - Frontend connected to Public IP
  - 2 Probes, HTTP and SSH
  - 2 Backends, master and worker
  - 2 rules, SSH to master backend, HTTP to worker backend
* 1 NSG connected to default subnet of VNet (Port 22/tcp allowed from all)
* 2 Ubuntu 18.04 VMs
  - No Public Inbound Ports
  - No accelerated networking
  - No Public IP
  - Add to load balancer - one in master backend, one in worker
  - Using the Azure CLI, add 30 IPs to each NIC, e.g.:
    - `for i in {1..30}; do az network nic ip-config create -g cni-test --nic-name worker-1108 --name pod-$i; done`

Install CNI, I'm doing it like this:
```shell
mkdir -p /opt/cni/bin
wget https://github.com/containernetworking/plugins/releases/download/v0.7.5/cni-plugins-amd64-v0.7.5.tgz -O /tmp/cni.tgz
tar xzvf /tmp/cni.tgz -C /opt/cni/bin

mkdir -p /etc/cni/net.d
wget https://github.com/Azure/azure-container-networking/releases/download/v1.0.20/azure-vnet-cni-linux-amd64-v1.0.20.tgz -O /tmp/azurecni.tgz
tar xzvf /tmp/azurecni.tgz -C /opt/cni/bin azure-vnet azure-vnet-ipam azure-vnet-telemetry
rm -rf /etc/cni/net.d/*.conf
rm -rf /etc/cni/net.d/*.conflist
tar xzvf /tmp/azurecni.tgz -C /etc/cni/net.d 10-azure.conflist
```

On the VMs, Deploy Docker/Containerd using your preferred method, again mine is as follows:

```shell
modprobe overlay
modprobe br_netfilter

cat <<EOF | tee /etc/sysctl.d/99-kubernetes-cri.conf
net.bridge.bridge-nf-call-iptables  = 1
net.ipv4.ip_forward                 = 1
net.bridge.bridge-nf-call-ip6tables = 1
EOF

sysctl --system

curl -fsSL https://download.docker.com/linux/ubuntu/gpg | apt-key add -
add-apt-repository \
    "deb [arch=amd64] https://download.docker.com/linux/ubuntu \
    $(lsb_release -cs) \
    stable"
apt-get update && apt-get install -y containerd.io
mkdir -p /etc/containerd
cd /etc/containerd
containerd config default > /etc/containerd/config.toml
sed -i 's/systemd_cgroup = false/systemd_cgroup = true/g' config.toml
systemctl restart containerd.service
```
Deploy Kubernetes using your favourite method, I'm doing it from scratch and I'm happy to provide the complete end-to-end script if thats helpful? But kubeadm with defaults (docker, etc) produces the same results for me.

**Comment by saiyan86** [comment]
@cpressland Please try again with [Azure CNI v1.0.22](https://github.com/Azure/azure-container-networking/releases/tag/v1.0.22). This version supports Ubuntu 18+.

**Comment by cpressland** [comment]
@saiyan86 can we reopen this? After deploying version 1.0.22 onto a node the network stack appears to be broken. External VNet communication appears to be offline and as such the node can no longer communicate with `169.254.169.254`. The Kubelet can no longer start as it needs to talk to this IP to get the Node IP Address. Worth noting that node-to-node and pod-to-pod traffic is fine.

Rebooting the node now takes upwards of half an hour as the node gets stuck on the following cloud-init job: `Starting Initial cloud-init job (metadata service crawler)...`

Finally, before the reboot the issue remained even when kube-proxy was operating in IPVS or iptables modes. So this version doesn't appear to change anything regarding my specific issue.

**Comment by cpressland** [comment]
Destroyed my `master-0` and `worker-0` nodes and bootstrapped again. Here is the error I get from CoreDNS:

```
E0504 23:50:58.337751       1 reflector.go:205] github.com/coredns/coredns/plugin/kubernetes/controller.go:355: Failed to list *v1.Namespace: Get https://172.16.0.1:443/api/v1/namespaces?limit=500&resourceVersion=0: dial tcp 172.16.0.1:443: i/o timeout
E0504 23:50:58.337951       1 reflector.go:205] github.com/coredns/coredns/plugin/kubernetes/controller.go:350: Failed to list *v1.Endpoints: Get https://172.16.0.1:443/api/v1/endpoints?limit=500&resourceVersion=0: dial tcp 172.16.0.1:443: i/o timeout
E0504 23:50:58.338070       1 reflector.go:205] github.com/coredns/coredns/plugin/kubernetes/controller.go:348: Failed to list *v1.Service: Get https://172.16.0.1:443/api/v1/services?limit=500&resourceVersion=0: dial tcp 172.16.0.1:443: i/o timeout
```

From the host this works fine:
```shell
laadmin@master-0:~$ telnet 172.16.0.1 443
Trying 172.16.0.1...
Connected to 172.16.0.1.
Escape character is '^]'.
```

ifconfig output on the host:
```
azure0: flags=4163<UP,BROADCAST,RUNNING,MULTICAST>  mtu 1500
        inet 10.0.0.4  netmask 255.255.0.0  broadcast 0.0.0.0
        inet6 fe80::20d:3aff:fe0b:488d  prefixlen 64  scopeid 0x20<link>
        ether 00:0d:3a:0b:48:8d  txqueuelen 1000  (Ethernet)
        RX packets 3108  bytes 12431115 (12.4 MB)
        RX errors 0  dropped 0  overruns 0  frame 0
        TX packets 2521  bytes 406059 (406.0 KB)
        TX errors 0  dropped 0 overruns 0  carrier 0  collisions 0

azv0b78befc4db: flags=67<UP,BROADCAST,RUNNING>  mtu 1500
        inet6 fe80::846:ffff:fef1:6eb5  prefixlen 64  scopeid 0x20<link>
        ether 0a:46:ff:f1:6e:b5  txqueuelen 1000  (Ethernet)
        RX packets 129  bytes 8937 (8.9 KB)
        RX errors 0  dropped 0  overruns 0  frame 0
        TX packets 135  bytes 8463 (8.4 KB)
        TX errors 0  dropped 0 overruns 0  carrier 0  collisions 0

azv9e93cc71ba8: flags=67<UP,BROADCAST,RUNNING>  mtu 1500
        inet6 fe80::b0ab:dfff:fec0:e7e6  prefixlen 64  scopeid 0x20<link>
        ether b2:ab:df:c0:e7:e6  txqueuelen 1000  (Ethernet)
        RX packets 121  bytes 8577 (8.5 KB)
        RX errors 0  dropped 0  overruns 0  frame 0
        TX packets 140  bytes 8764 (8.7 KB)
        TX errors 0  dropped 0 overruns 0  carrier 0  collisions 0

eth0: flags=67<UP,BROADCAST,RUNNING>  mtu 1500
        inet6 fe80::20d:3aff:fe0b:488d  prefixlen 64  scopeid 0x20<link>
        ether 00:0d:3a:0b:48:8d  txqueuelen 1000  (Ethernet)
        RX packets 18270  bytes 14877915 (14.8 MB)
        RX errors 0  dropped 0  overruns 0  frame 0
        TX packets 9773  bytes 1844291 (1.8 MB)
        TX errors 0  dropped 0 overruns 0  carrier 0  collisions 0

lo: flags=73<UP,LOOPBACK,RUNNING>  mtu 65536
        inet 127.0.0.1  netmask 255.0.0.0
        inet6 ::1  prefixlen 128  scopeid 0x10<host>
        loop  txqueuelen 1000  (Local Loopback)
        RX packets 59768  bytes 10514916 (10.5 MB)
        RX errors 0  dropped 0  overruns 0  frame 0
        TX packets 59768  bytes 10514916 (10.5 MB)
        TX errors 0  dropped 0 overruns 0  carrier 0  collisions 0
```

Output of `iptables -L`
```
Chain INPUT (policy ACCEPT)
target     prot opt source               destination
KUBE-FIREWALL  all  --  anywhere             anywhere
KUBE-SERVICES  all  --  anywhere             anywhere             ctstate NEW /* kubernetes service portals */
KUBE-EXTERNAL-SERVICES  all  --  anywhere             anywhere             ctstate NEW /* kubernetes externally-visible service portals */

Chain FORWARD (policy ACCEPT)
target     prot opt source               destination
KUBE-FORWARD  all  --  anywhere             anywhere             /* kubernetes forwarding rules */
KUBE-SERVICES  all  --  anywhere             anywhere             ctstate NEW /* kubernetes service portals */

Chain OUTPUT (policy ACCEPT)
target     prot opt source               destination
KUBE-FIREWALL  all  --  anywhere             anywhere
KUBE-SERVICES  all  --  anywhere             anywhere             ctstate NEW /* kubernetes service portals */

Chain KUBE-EXTERNAL-SERVICES (1 references)
target     prot opt source               destination

Chain KUBE-FIREWALL (2 references)
target     prot opt source               destination
DROP       all  --  anywhere             anywhere             /* kubernetes firewall for dropping marked packets */ mark match 0x8000/0x8000

Chain KUBE-FORWARD (1 references)
target     prot opt source               destination
ACCEPT     all  --  anywhere             anywhere             /* kubernetes forwarding rules */ mark match 0x4000/0x4000
ACCEPT     all  --  10.0.0.0/16          anywhere             /* kubernetes forwarding conntrack pod source rule */ ctstate RELATED,ESTABLISHED
ACCEPT     all  --  anywhere             10.0.0.0/16          /* kubernetes forwarding conntrack pod destination rule */ ctstate RELATED,ESTABLISHED

Chain KUBE-SERVICES (3 references)
target     prot opt source               destination
```

Output of `iptables -t nat -L`
```
Chain PREROUTING (policy ACCEPT)
target     prot opt source               destination
KUBE-SERVICES  all  --  anywhere             anywhere             /* kubernetes service portals */

Chain INPUT (policy ACCEPT)
target     prot opt source               destination

Chain OUTPUT (policy ACCEPT)
target     prot opt source               destination
KUBE-SERVICES  all  --  anywhere             anywhere             /* kubernetes service portals */

Chain POSTROUTING (policy ACCEPT)
target     prot opt source               destination
KUBE-POSTROUTING  all  --  anywhere             anywhere             /* kubernetes postrouting rules */

Chain KUBE-MARK-DROP (0 references)
target     prot opt source               destination
MARK       all  --  anywhere             anywhere             MARK or 0x8000

Chain KUBE-MARK-MASQ (8 references)
target     prot opt source               destination
MARK       all  --  anywhere             anywhere             MARK or 0x4000

Chain KUBE-NODEPORTS (1 references)
target     prot opt source               destination

Chain KUBE-POSTROUTING (1 references)
target     prot opt source               destination
MASQUERADE  all  --  anywhere             anywhere             /* kubernetes service traffic requiring SNAT */ mark match 0x4000/0x4000

Chain KUBE-SEP-3KMN2M7HVJ6NJ7R4 (1 references)
target     prot opt source               destination
KUBE-MARK-MASQ  all  --  10.0.0.11            anywhere
DNAT       udp  --  anywhere             anywhere             udp to:10.0.0.11:53

Chain KUBE-SEP-EODZHVGXMPR65AQG (1 references)
target     prot opt source               destination
KUBE-MARK-MASQ  all  --  10.0.0.6             anywhere
DNAT       tcp  --  anywhere             anywhere             tcp to:10.0.0.6:53

Chain KUBE-SEP-KU4NHU4OEUQXNSNJ (1 references)
target     prot opt source               destination
KUBE-MARK-MASQ  all  --  10.0.0.11            anywhere
DNAT       tcp  --  anywhere             anywhere             tcp to:10.0.0.11:53

Chain KUBE-SEP-SCDYEFQS53DIYLB3 (1 references)
target     prot opt source               destination
KUBE-MARK-MASQ  all  --  master-0             anywhere
DNAT       tcp  --  anywhere             anywhere             tcp to:10.0.0.4:6443

Chain KUBE-SEP-V5LWH4IZOOKXWHBQ (1 references)
target     prot opt source               destination
KUBE-MARK-MASQ  all  --  10.0.0.6             anywhere
DNAT       udp  --  anywhere             anywhere             udp to:10.0.0.6:53

Chain KUBE-SERVICES (2 references)
target     prot opt source               destination
KUBE-MARK-MASQ  tcp  -- !10.0.0.0/16          172.16.0.10          /* kube-system/coredns:dns-tcp cluster IP */ tcp dpt:domain
KUBE-SVC-FAITROITGXHS3QVF  tcp  --  anywhere             172.16.0.10          /* kube-system/coredns:dns-tcp cluster IP */ tcp dpt:domain
KUBE-MARK-MASQ  tcp  -- !10.0.0.0/16          172.16.0.1           /* default/kubernetes:https cluster IP */ tcp dpt:https
KUBE-SVC-NPX46M4PTMTKRN6Y  tcp  --  anywhere             172.16.0.1           /* default/kubernetes:https cluster IP */ tcp dpt:https
KUBE-MARK-MASQ  udp  -- !10.0.0.0/16          172.16.0.10          /* kube-system/coredns:dns cluster IP */ udp dpt:domain
KUBE-SVC-ZRLRAB2E5DTUX37C  udp  --  anywhere             172.16.0.10          /* kube-system/coredns:dns cluster IP */ udp dpt:domain
KUBE-NODEPORTS  all  --  anywhere             anywhere             /* kubernetes service nodeports; NOTE: this must be the last rule in this chain */ ADDRTYPE match dst-type LOCAL

Chain KUBE-SVC-FAITROITGXHS3QVF (1 references)
target     prot opt source               destination
KUBE-SEP-KU4NHU4OEUQXNSNJ  all  --  anywhere             anywhere             statistic mode random probability 0.50000000000
KUBE-SEP-EODZHVGXMPR65AQG  all  --  anywhere             anywhere

Chain KUBE-SVC-NPX46M4PTMTKRN6Y (1 references)
target     prot opt source               destination
KUBE-SEP-SCDYEFQS53DIYLB3  all  --  anywhere             anywhere

Chain KUBE-SVC-ZRLRAB2E5DTUX37C (1 references)
target     prot opt source               destination
KUBE-SEP-3KMN2M7HVJ6NJ7R4  all  --  anywhere             anywhere             statistic mode random probability 0.50000000000
KUBE-SEP-V5LWH4IZOOKXWHBQ  all  --  anywhere             anywhere
```

And again, after a reboot of this node I get the VM go into a very long timeout that takes a long time to clear, this is from the Serial Log.

```
[[0;32m  OK  [0m] Started File System Check on /dev/disk/cloud/azure_resource-part1.
[[0;32m  OK  [0m] Started Set console font and keymap.
[[0;32m  OK  [0m] Started Tell Plymouth To Write Out Runtime Data.
[[0;32m  OK  [0m] Started Create Volatile Files and Directories.
         Starting Update UTMP about System Boot/Shutdown...
         Starting Network Time Synchronization...
[[0;32m  OK  [0m] Started ebtables ruleset management.
[[0;32m  OK  [0m] Started Update UTMP about System Boot/Shutdown.
[[0;32m  OK  [0m] Started AppArmor initialization.
         Starting Initial cloud-init job (pre-networking)...
[    9.283403] sh[755]: + [ -e /var/lib/cloud/instance/obj.pkl ]
[    9.298100] sh[755]: + echo cleaning persistent cloud-init object
[[0;32m  OK  [0m] Started Network Time Synchronization.
[[0;32m  OK  [0m] Reached target System Time Synchronized.
[    9.316719] sh[755]: cleaning persistent cloud-init object
[    9.322984] sh[755]: + rm /var/lib/cloud/instance/obj.pkl
[    9.332687] sh[755]: + exit 0
[   11.261773] cloud-init[760]: Cloud-init v. 18.5-45-g3554ffe8-0ubuntu1~18.04.1 running 'init-local' at Sat, 04 May 2019 23:56:00 +0000. Up 10.09 seconds.
[[0;32m  OK  [0m] Started Initial cloud-init job (pre-networking).
[[0;32m  OK  [0m] Reached target Network (Pre).
         Starting Network Service...
[[0;32m  OK  [0m] Started Network Service.
         Starting Network Name Resolution...
         Starting Wait for Network to be Configured...
[[0;32m  OK  [0m] Started Network Name Resolution.
[[0;32m  OK  [0m] Reached target Network.
[[0;32m  OK  [0m] Reached target Host and Network Name Lookups.
[[0;32m  OK  [0m] Started Wait for Network to be Configured.
         Starting Initial cloud-init job (metadata service crawler)...
```

**Comment by t0mmyt** [comment]
This is also happening for me when I set a default route on the cluster subnet (service subnet is not accessible from pods).

**Comment by tamilmani1989** [comment]
@cpressland I looked at your iptables nat rules. It looks like a snat rule is missing for external connectivity to happen. I hope that you haven't deploy kubernetes cluster using aks or aks-engine..

Please add this rule and check for internet connectivity

iptables -t nat -A POSTROUTING  -m addrtype ! --dst-type local ! -d <vnet_address_space> -j MASQUERADE

**Comment by cpressland** [comment]
@tamilmani1989 that certainly helps with outbound communication from pods to external sources. Any suggestions on making that persistent on my cluster? And no, I'm not using aks or aks-engine - we're building a cluster from scratch as we have some unique security requirements.

Else, IPVS still doesn't appear to work at all with Azure-CNI, I've yet to track down why. iptables appears to be fine on 16.04, while Azure-CNI renders 18.04 nodes unbootable.

**Comment by tamilmani1989** [comment]
For ubuntu18 please use latest cni. 

For persisting iptable rules, you have to install iptables-persistent and do iptables-save. check below link:
https://www.thomas-krenn.com/en/wiki/Saving_Iptables_Firewall_Rules_Permanently

**Comment by fl-max** [comment]
I'm experiencing the same thin using IPVS and Azure CNI.

**CoreDNS log:**
`
.:53
2019-09-11T18:42:20.864Z [INFO] CoreDNS-1.3.1
2019-09-11T18:42:20.865Z [INFO] linux/amd64, go1.11.4, 6b56a9c
CoreDNS-1.3.1
linux/amd64, go1.11.4, 6b56a9c
2019-09-11T18:42:20.865Z [INFO] plugin/reload: Running configuration MD5 = 00544075aef6676ea56bc6d88f2b7467
E0911 18:42:45.865301       1 reflector.go:134] github.com/coredns/coredns/plugin/kubernetes/controller.go:322: Failed to list *v1.Namespace: Get https://10.0.0.1:443/api/v1/namespaces?limit=500&resourceVersion=0: dial tcp 10.0.0.1:443: i/o timeout
E0911 18:42:45.865301       1 reflector.go:134] github.com/coredns/coredns/plugin/kubernetes/controller.go:322: Failed to list *v1.Namespace: Get https://10.0.0.1:443/api/v1/namespaces?limit=500&resourceVersion=0: dial tcp 10.0.0.1:443: i/o timeout
log: exiting because of error: log: cannot create log: open /tmp/coredns.coredns-5c98db65d4-wsdz9.unknownuser.log.ERROR.20190911-184245.1: no such file or directory
`

**Environment**:
OS: `CentOS Linux release 7.4.1708 (Core)`
Kernel: `3.10.0-693.11.1.el7.x86_64`
Kubernetes: `v1.15.4`
Azure CNI: `v1.0.27`
CNI Plugin: `v0.8.2`
CNI: `v0.6.0`
ipset: `ipset v6.38, protocol version: 6`

**kube-proxy log**:
`
I0911 13:46:44.779517       1 server_others.go:170] Using ipvs Proxier.
W0911 13:46:44.824262       1 proxier.go:401] IPVS scheduler not specified, use rr by default
I0911 13:46:44.825186       1 server.go:534] Version: v1.15.3
I0911 13:46:44.927248       1 conntrack.go:100] Set sysctl 'net/netfilter/nf_conntrack_max' to 131072
I0911 13:46:44.927303       1 conntrack.go:52] Setting nf_conntrack_max to 131072
I0911 13:46:44.927392       1 conntrack.go:100] Set sysctl 'net/netfilter/nf_conntrack_tcp_timeout_established' to 86400
I0911 13:46:44.927451       1 conntrack.go:100] Set sysctl 'net/netfilter/nf_conntrack_tcp_timeout_close_wait' to 3600
I0911 13:46:44.928860       1 config.go:96] Starting endpoints config controller
I0911 13:46:44.928981       1 controller_utils.go:1029] Waiting for caches to sync for endpoints config controller
I0911 13:46:44.929692       1 config.go:187] Starting service config controller
I0911 13:46:44.929722       1 controller_utils.go:1029] Waiting for caches to sync for service config controller
I0911 13:46:45.029157       1 controller_utils.go:1036] Caches are synced for endpoints config controller
I0911 13:46:45.031635       1 controller_utils.go:1036] Caches are synced for service config controller
`

**ipvsadm:**
`
$ ipvsadm -ln
IP Virtual Server version 1.2.1 (size=4096)
Prot LocalAddress:Port Scheduler Flags
  -> RemoteAddress:Port           Forward Weight ActiveConn InActConn
TCP  10.0.0.1:443 rr
  -> 10.225.171.242:6443          Masq    1      0          0         
TCP  10.0.0.10:53 rr
TCP  10.0.0.10:9153 rr
TCP  10.0.39.56:443 rr
TCP  10.0.101.161:44134 rr
  -> 10.225.171.239:44134         Masq    1      0          0         
UDP  10.0.0.10:53 rr
`

**iptables:**
`
$ iptables -L
Chain INPUT (policy ACCEPT)
target     prot opt source               destination         
KUBE-FIREWALL  all  --  anywhere             anywhere            

Chain FORWARD (policy ACCEPT)
target     prot opt source               destination         
KUBE-FORWARD  all  --  anywhere             anywhere             /* kubernetes forwarding rules */
DOCKER-USER  all  --  anywhere             anywhere            
DOCKER-ISOLATION-STAGE-1  all  --  anywhere             anywhere            
ACCEPT     all  --  anywhere             anywhere             ctstate RELATED,ESTABLISHED
DOCKER     all  --  anywhere             anywhere            
ACCEPT     all  --  anywhere             anywhere            
ACCEPT     all  --  anywhere             anywhere            

Chain OUTPUT (policy ACCEPT)
target     prot opt source               destination         
KUBE-FIREWALL  all  --  anywhere             anywhere            

Chain DOCKER (1 references)
target     prot opt source               destination         

Chain DOCKER-ISOLATION-STAGE-1 (1 references)
target     prot opt source               destination         
DOCKER-ISOLATION-STAGE-2  all  --  anywhere             anywhere            
RETURN     all  --  anywhere             anywhere            

Chain DOCKER-ISOLATION-STAGE-2 (1 references)
target     prot opt source               destination         
DROP       all  --  anywhere             anywhere            
RETURN     all  --  anywhere             anywhere            

Chain DOCKER-USER (1 references)
target     prot opt source               destination         
RETURN     all  --  anywhere             anywhere            

Chain KUBE-FIREWALL (2 references)
target     prot opt source               destination         
DROP       all  --  anywhere             anywhere             /* kubernetes firewall for dropping marked packets */ mark match 0x8000/0x8000

Chain KUBE-FORWARD (1 references)
target     prot opt source               destination         
ACCEPT     all  --  anywhere             anywhere             /* kubernetes forwarding rules */ mark match 0x4000/0x4000
ACCEPT     all  --  10.225.168.0/21      anywhere             /* kubernetes forwarding conntrack pod source rule */ ctstate RELATED,ESTABLISHED
ACCEPT     all  --  anywhere             10.225.168.0/21      /* kubernetes forwarding conntrack pod destination rule */ ctstate RELATED,ESTABLISHED
`

**ipset**:
`
$ ipset list
Name: KUBE-LOOP-BACK
Type: hash:ip,port,ip
Revision: 2
Header: family inet hashsize 1024 maxelem 65536
Size in memory: 16632
References: 1
Members:
10.225.171.239,tcp:44134,10.225.171.239

Name: KUBE-LOAD-BALANCER
Type: hash:ip,port
Revision: 2
Header: family inet hashsize 1024 maxelem 65536
Size in memory: 16528
References: 0
Members:

Name: KUBE-NODE-PORT-UDP
Type: bitmap:port
Revision: 1
Header: range 0-65535
Size in memory: 524432
References: 0
Members:

Name: KUBE-NODE-PORT-LOCAL-UDP
Type: bitmap:port
Revision: 1
Header: range 0-65535
Size in memory: 524432
References: 0
Members:

Name: KUBE-NODE-PORT-SCTP-HASH
Type: hash:ip,port
Revision: 2
Header: family inet hashsize 1024 maxelem 65536
Size in memory: 16528
References: 0
Members:

Name: KUBE-CLUSTER-IP
Type: hash:ip,port
Revision: 2
Header: family inet hashsize 1024 maxelem 65536
Size in memory: 16720
References: 2
Members:
10.0.0.10,tcp:9153
10.0.39.56,tcp:443
10.0.0.10,udp:53
10.0.0.10,tcp:53
10.0.101.161,tcp:44134
10.0.0.1,tcp:443

Name: KUBE-EXTERNAL-IP
Type: hash:ip,port
Revision: 2
Header: family inet hashsize 1024 maxelem 65536
Size in memory: 16528
References: 0
Members:

Name: KUBE-LOAD-BALANCER-SOURCE-CIDR
Type: hash:ip,port,net
Revision: 4
Header: family inet hashsize 1024 maxelem 65536
Size in memory: 16792
References: 0
Members:

Name: KUBE-NODE-PORT-TCP
Type: bitmap:port
Revision: 1
Header: range 0-65535
Size in memory: 524432
References: 0
Members:

Name: KUBE-NODE-PORT-LOCAL-SCTP-HASH
Type: hash:ip,port
Revision: 2
Header: family inet hashsize 1024 maxelem 65536
Size in memory: 16528
References: 0
Members:

Name: KUBE-LOAD-BALANCER-FW
Type: hash:ip,port
Revision: 2
Header: family inet hashsize 1024 maxelem 65536
Size in memory: 16528
References: 0
Members:

Name: KUBE-NODE-PORT-LOCAL-TCP
Type: bitmap:port
Revision: 1
Header: range 0-65535
Size in memory: 524432
References: 0
Members:

Name: KUBE-LOAD-BALANCER-LOCAL
Type: hash:ip,port
Revision: 2
Header: family inet hashsize 1024 maxelem 65536
Size in memory: 16528
References: 0
Members:

Name: KUBE-LOAD-BALANCER-SOURCE-IP
Type: hash:ip,port,ip
Revision: 2
Header: family inet hashsize 1024 maxelem 65536
Size in memory: 16536
References: 0
Members:
`

**modules**:
`
$ cut -f1 -d " "  /proc/modules | grep -e ip_vs -e nf_conntrack_ipv4
ip_vs_sh
ip_vs_wrr
ip_vs_rr
ip_vs
nf_conntrack_ipv4
`

**ifconfig**:
`
$ ifconfig
azure0: flags=4163<UP,BROADCAST,RUNNING,MULTICAST>  mtu 1500
        inet 10.225.171.239  netmask 255.255.252.0  broadcast 0.0.0.0
        ether 00:0d:3a:7b:1c:de  txqueuelen 1000  (Ethernet)
        RX packets 2988967  bytes 1096999429 (1.0 GiB)
        RX errors 0  dropped 0  overruns 0  frame 0
        TX packets 2661508  bytes 502781258 (479.4 MiB)
        TX errors 0  dropped 0 overruns 0  carrier 0  collisions 0

azv6b28cfd207e: flags=67<UP,BROADCAST,RUNNING>  mtu 1500
        ether 72:58:81:d0:56:dc  txqueuelen 1000  (Ethernet)
        RX packets 527  bytes 32738 (31.9 KiB)
        RX errors 0  dropped 0  overruns 0  frame 0
        TX packets 1005  bytes 42754 (41.7 KiB)
        TX errors 0  dropped 0 overruns 0  carrier 0  collisions 0

azv91fdf643bf7: flags=67<UP,BROADCAST,RUNNING>  mtu 1500
        ether 6a:9b:4e:12:0b:d7  txqueuelen 1000  (Ethernet)
        RX packets 2096  bytes 164001 (160.1 KiB)
        RX errors 0  dropped 0  overruns 0  frame 0
        TX packets 2106  bytes 144316 (140.9 KiB)
        TX errors 0  dropped 0 overruns 0  carrier 0  collisions 0

azvb791fc10b26: flags=67<UP,BROADCAST,RUNNING>  mtu 1500
        ether 66:70:b9:cb:08:1b  txqueuelen 1000  (Ethernet)
        RX packets 2083  bytes 162984 (159.1 KiB)
        RX errors 0  dropped 0  overruns 0  frame 0
        TX packets 2092  bytes 143195 (139.8 KiB)
        TX errors 0  dropped 0 overruns 0  carrier 0  collisions 0

docker0: flags=4099<UP,BROADCAST,MULTICAST>  mtu 1500
        inet 172.17.0.1  netmask 255.255.0.0  broadcast 172.17.255.255
        ether 02:42:c7:4a:3e:19  txqueuelen 0  (Ethernet)
        RX packets 0  bytes 0 (0.0 B)
        RX errors 0  dropped 0  overruns 0  frame 0
        TX packets 0  bytes 0 (0.0 B)
        TX errors 0  dropped 0 overruns 0  carrier 0  collisions 0

eth0: flags=67<UP,BROADCAST,RUNNING>  mtu 1500
        ether 00:0d:3a:7b:1c:de  txqueuelen 1000  (Ethernet)
        RX packets 3351737  bytes 1630392851 (1.5 GiB)
        RX errors 0  dropped 0  overruns 0  frame 0
        TX packets 2772953  bytes 513726390 (489.9 MiB)
        TX errors 0  dropped 0 overruns 0  carrier 0  collisions 0

lo: flags=73<UP,LOOPBACK,RUNNING>  mtu 65536
        inet 127.0.0.1  netmask 255.0.0.0
        loop  txqueuelen 1  (Local Loopback)
        RX packets 1685102  bytes 240771614 (229.6 MiB)
        RX errors 0  dropped 0  overruns 0  frame 0
        TX packets 1685102  bytes 240771614 (229.6 MiB)
        TX errors 0  dropped 0 overruns 0  carrier 0  collisions 0
`

**Note**: The same setup works when kube-proxy is in iptables mode.
